Phrase en Anglais;Phrase en Français
A recruit? What do you want with this gatehouse?${prompt};
Only citizens of San d'Oria may apply for missions here. Go see your country's consulate in Northern San d'Oria.${prompt};
Finish your current mission first, then come back for another.${prompt};
Which mission will you undertake?;
${selection-lines};
Smash the Orcish Scouts.;
Bat Hunt.;
Save the Children.;
The Rescue Drill.;
The Davoi Report.;
Journey Abroad.;
Journey to Bastok.;
Journey to Windurst.;
Journey to Bastok.;
Journey to Windurst.;
Infiltrate Davoi.;
The Crystal Spring.;
Appointment to Jeuno.;
Magicite.;
The Ruins of Fei'Yin.;
The Shadow Lord.;
Leaute's Last Wishes.;
Ranperre's Final Rest.;
Prestige of the Papsque.;
The Secret Weapon.;
Coming of Age.;
Lightbringer.;
Breaking Barriers.;
The Heir to the Light.;
10-1.;
10-2.;
ダミー26.;
ダミー27.;
ダミー28.;
ダミー29.;
ダミー30.;
None.${prompt};
Accept this mission?;
${selection-lines};
Yes.;
No.${prompt};
You accept the mission.${prompt};
What do you want with this gatehouse?${prompt};
Your business?;
${selection-lines};
A mission, please.;
Nothing.${prompt};
Hmm...not much work for those wet behind the ears, but...${prompt};
How about slaying Orcish scouts? Only the yellowest of yearlings would run from that, and we've no work for cowards here.${prompt};
If you're to take the mission, I'll be happy to explain.${prompt};
Interested?;
${selection-lines};
Tell me more.;
Never mind.${prompt};
"Here's your mission. Orcish scouts roam outside; kill one and bring me his axe as proof.${prompt}";
You'll have to bring me ${article} ${item-article: 0[2]}. No other kind will do. Understand?${prompt};
That is all. You'll take the mission then?${prompt};
Do you accept the mission?;
${selection-lines};
I accept.;
Could you explain again?;
No, thank you.${prompt};
"Bring me one of those axes, and your mission will be a success. No running away now; we've a proud country to defend!${prompt}";
Oh, you're back. Well, if you're so happy you defeated an Orc or two, you've a long way ahead of you!${prompt};
That's another ${item-singular: 0[2]} for the armory, then. Mission complete! Not bad for a new recruit.${prompt};
What? I don't want this!${prompt};
Are you really a new recruit!?${prompt};
Listen, before you bring me something, you must first accept the mission! That is how things work around here!${prompt};
Persistent, aren't you? An Orc under the belt does not a hero make! Ah, I've just the job for you...${prompt};
Bat patrol! How about it? Shouldn't be a problem for an adventurer such as yourself, no?${prompt};
Here's your mission, then. Clear out bats lurking in King Ranperre's Tomb and bring me a fang as proof.${prompt};
Bring me ${article} ${item-article: 0[2]} and your mission will be a success.${prompt};
"Deep in the tomb you'll find Goblins. Take care; I don't want to lose you yet.${prompt}";
Ah, you've returned! I was afraid that Goblins got you.${prompt};
That's one ${item-singular: 3[2]} for the gatehouse, then. Mission complete. Not bad for a new recruit.${prompt};
Ah, the recruit's back again? I'm sorry, but I've no time for you today.${prompt};
Well, perhaps you can be of some help. Many of our children have disappeared mysteriously, and I've no doubt the Ghelsba Orcs are behind it.${prompt};
The Royal Knights should be on the job by now, but the two princes are at each other's throats.${prompt};
Prince Trion, the eldest, says we should launch a full attack, with all haste.${prompt};
While his younger brother, Prince Pieuje says the safety of the children comes first, and he won't authorize an attack.${prompt};
They've been arguing this back and forth for days. The knights' hands are tied, and frankly, nobody knows what to do.${prompt};
If you really want to make a name for yourself, go to Ghelsba, and rescue those kidnapped children!${prompt};
What say you? Will you go?${prompt};
Here's your mission, then. Rescue the two children kidnapped by the Orcs of Ghelsba Outpost.${prompt};
Ghelsba Outpost is northwest of West Ronfaure. Take the path before the Westgate, then turn right when the path splits in the forest. You'll find the entrance up in the hills.${prompt};
If you have trouble finding the way, just follow one of the soldiers on patrol.${prompt};
Orcs tend to keep their hostages in tents or small huts. Once you're inside the compound, check them first.${prompt};
Ah, you've returned! You were gone so long, I feared a warmachine had got you!${prompt};
At any rate, mission complete! And to reward your accomplishment...${prompt};
I hereby recognize you, ${name-player}, as a certified adventurer of San d'Oria! You're now mission rank two, as well.${prompt};
But don't get too excited. Your title is valid only here in San d'Oria, understand?${prompt};
In order to become a true adventurer, and bear ${keyitem-article: 0[2]}, you must be recognized by Bastok and Windurst as well.${prompt};
'Tis a treaty between the three lands, and its word is law. I know it's hard, but those are the rules.${prompt};
For now, cut your adventuring teeth in the areas near here. Sooner or later you'll find your way into other lands.${prompt};
You achieve rank 2!${prompt};
There's not much work in right now. I suppose you could go participate in the Temple Knights' rescue drills out on the La Theine Plateau.${prompt};
Enter the forest beyond the Westgate and head southwest. You'll come out onto the La Theine Plateau before long.${prompt};
Once you're out on the plateau, keep going until you see the knights. The training grounds aren't far from there.${prompt};
It's all just a drill, so this should be easy compared to your usual fare. Just follow orders and you'll be fine.${prompt};
You've returned! I hear the drill turned into something far more perilous. But real battle is the best drill for recruits, in my opinion.${prompt};
Regardless, you've done well. I'll turn to you when there's work to be done, now.${prompt};
Here, take this ${item-singular: 3[2]}. Go ahead, you've earned it.${prompt};
This time it's messenger duty. One of our knights is out scouting in a place called Davoi, on the southern edge of Jugner Forest.${prompt};
The Orcs' stronghold is in Davoi, so it's vital that we stop them from massing, or they may launch an assault.${prompt};
Of course, the Orcs are keeping an eye on us, too. Why, just a few days past, a squad of our Royal Knights fell to their axes.${prompt};
We have sent scouts to find a weakness in their defenses. You must find the scout there now, and bring back the latest scouting report.${prompt};
The scout's name is Zantaviat. He's somewhere in Davoi, but where I cannot say.${prompt};
Come back after you've gotten the report. Those lands are no place to wander.${prompt};
You have returned! And you've brought the scouting report. Good work, ${name-player}.${prompt};
Troubling news, this is. It says that Orcs are gathering deep inside the encampment. The time to act is coming!${prompt};
But that is not your concern. You've done well today. Mission complete!${prompt};
Oh, it's you, ${name-player}. And at just the right time, too. Monarlais Halver is looking for an adventurer such as yourself.${prompt};
"Enter Chateau d'Oraguille. Monarlais Halver is there; he'll explain in person.${prompt}";
What? You haven't been certified in Bastok and Windurst yet? You may dally, but others are not! Get moving!${prompt};
Ah, welcome back. I see you've been certified in Bastok and Windurst. Good work. You'll make a fine adventurer.${prompt};
What's that, a report for our kingdom? I see. Take that to the monarlais when you go.${prompt};
You should receive ${keyitem-article: 0[2]} from Monarlais Halver. Now, go to Chateau d'Oraguille and let them know you're back!${prompt};
Hurry to Chateau d'Oraguille and give that report to Monarlais Halver!${prompt};
You achieve rank 3!${prompt};
Ah! You've come at just the right time. Zantaviat, one of our scouts in Davoi, needs an adventurer.${prompt};
He wants someone to infiltrate Davoi and scout behind enemy lines. Know anyone fitting that description?${prompt};
Now that you've got your ${keyitem-singular: 0[2]}, this is an opportunity to prove you're worth it!${prompt};
The situation in Davoi worsens by the day. This won't be easy, but I can't think of a better adventurer for the job!${prompt};
You've returned! Zantaviat told me everything. Congratulations on a job well done!${prompt};
But we can't let down our guard yet. Those Orcs will not just sit there. We must keep constant vigil, and move before they do!${prompt};
Here's your reward: ${article} ${item-article: 0[2]}. You're becoming quite the adventurer, aren't you?${prompt};
Welcome back! I have an important mission for you this time. Recently, land is eroding due to crystal formation...and it's getting worse.${prompt};
There's a small spring on the eastern edge of Jugner Forest, called Crystwater Spring. We must know what effect crystal formation has on the wildlife there.${prompt};
I want you to get me a fish from the spring. And not just any fish! You need to get ${article} ${item-article: 0[2]}.${prompt};
Ah, that reminds me--have you any fishing gear? You'll need some for this mission.${prompt};
There are people about that know a thing or two about fishing, should you need help finding and choosing your gear.${prompt};
Ah, the great angler returns! I was worried, to be honest. All you hear these days is the massing of beasts, the erosion of the Crystal Lines, and now...${prompt};
...rumors that the Shadow Lord himself has returned!${prompt};
We will examine the fish you brought. Depending on the results, we may need to act! I'll let you know if we need your help.${prompt};
Ah, it's you, ${name-player}. You've come at a good time. I've news for you.${prompt};
By order of the Kingdom of San d'Oria, you're to head to Jeuno as an ambassadorial attaché.${prompt};
Go to Chateau d'Oraguille. Monarlais Halver will tell you all you need to know.${prompt};
${prompt};
${prompt};
${prompt};
${prompt};
${prompt};
${prompt};
${prompt};
${prompt};
There you are! I've been looking for you. Monarlais Halver requests your presence at the chateau immediately.${prompt};
It sounds as if this is a fairly important mission. I need not remind you that you should take care to properly equip yourself before embarking on this journey.${prompt};
I'm not sure what it's about, but you'd best make haste. The monarlais is not to be kept waiting!${prompt};
Why, if it isn't ${name-player}! This is no time for loafing around, friend! Prince Trion is looking for you.${prompt};
For this next mission, he's requested you personally. You should be honored!${prompt};
As for the details of the mission, I've no idea what he wants, but he was in a hurry. You'd best be off to Chateau d'Oraguille!${prompt};
It is a great thing you've done, ${name-player}! I knew deep in my heart that you were the one for the task.${prompt};
You'd better get to the chateau quick. They're all waiting to welcome you back, I'd wager.${prompt};
You've saved our proud Kingdom of San d'Oria. No, you're the savior of all Vana'diel! There's not a soul that doesn't owe you a great debt, ${name-player}.${prompt};
Ah, if it isn't ${name-player}!;
You had best hurry off to Chateau d'Oraguille. It seems as if something terrible is in the works there.${prompt};
Well, if it isn't ${name-player}!;
Your timing is perfect. The chateau just sent a request for an adventurer.${prompt};
It looks as if this next mission has something to do with the late queen. You should feel honored. It's not every day that an adventurer gets to work directly with the royal family.${prompt};
Spoken like a true San d'Orian!;
Now hurry off to Chateau d'Oraguille and get the details on the mission from Monarlais Halver.${prompt};
What's wrong? Dealing with royalty is not your cup of tea? Well, think about it and come back when you've come to your senses.${prompt};
Prince Trion is requesting the aid of an adventurer. How about it?${prompt};
It looks fairly urgent, so you should hurry to the chateau. The prince is waiting in his chambers.${prompt};
I expected more from you, ${name-player}. If you change your mind, return here. I'll be waiting.${prompt};
I have received the details of your mission from Prince Trion. I will deliver this book to the scholars for deciphering.${prompt};
The deciphering of the ${keyitem-singular: 0[2]} will take a considerable amount of time. Return later for a report.${prompt};
You handed the ${keyitem-singular: 0[2]} over to the guard.${prompt};
Ah, ${name-player}. We've been waiting.;
Prince Trion is calling for you. I wonder if this means the ${keyitem-singular: 0[2]} has been completely deciphered.${prompt};
Well done, ${name-player}! I knew you would not let the Kingdom down.${prompt};
I'm proud to increase your rank to 7!${prompt};
The papsque has work for you, ${name-player}. Are you willing to take on the task?${prompt};
Excellent. Proceed to the papsque's chambers on the third floor of the cathedral.${prompt};
The papsque often comes across as a difficult man, but he is actually very kindhearted and compassionate. If you change your mind, I'll be waiting here.${prompt};
The fair Claidie I d'Oraguille has invited you to the chateau. She wishes for you to see the flowers that have bloomed from the seeds you brought back from Altepa.${prompt};
It is an honor to be invited to the chateau garden. One day you may even have the opportunity to attend one of their royal garden parties.${prompt};
We cannot keep the princess waiting. Now, off to the chateau!${prompt};
A party of Royal Knights stationed in Ghelsba Outpost have reported strange activity by Orcs deep within Yughott Grotto.${prompt};
From your reports, we already know that the beastmen have built a giant portal, but their motives remain unclear.${prompt};
It makes me shudder to think of what those Orcs are planning with that portal...${prompt};
${name-player}, your next mission is to travel to Ghelsba and continue your investigation into the Orcs' activities.${prompt};
Be on your guard when traveling deep into Yughott Grotto. Losing an adventurer such as yourself would deal a great blow to all of San d'Oria.${prompt};
I see you need more time for preparations. When you are ready, I'll be waiting.${prompt};
It's hard to believe Orcs have their hands on such dangerous equipment. More patrols will have to be sent out to prevent any new developments in their evil plans.${prompt};
And this ${keyitem-singular: 0[2]}... We will have to analyze it and begin reproduction for our forces. We cannot let Orcs get the Treasure of the Dragon King before San d'Oria does.${prompt};
Well, congratulations on the completion of your mission. Hmmm? Do I know of an adventurer named Eideialc? Never heard of him.${prompt};
But you need not worry about some petty traveler. You are in a different league. You are now rank 8!${prompt};
Princess Claidie's coming-of-age ceremony is drawing near. This ceremony is an important facet of d'Oraguille tradition.${prompt};
Monarlais Halver has put out a call to high-ranking adventurers for their assistance in Chateau d'Oraguille.${prompt};
Ah, the young princess has finally become a lady... Oh, I'm sorry. You can get the details of your next mission from Sir Halver.${prompt};
What? You do not wish to repay the kindness the princess has shown to you in the past months? As you wish...but if you change your mind, you know where to find me.${prompt};
I am busy with preparations for Princess Claidie's coming-of-age ceremony. You don't know what kind of vermin could be roaming the streets and looking for trouble.${prompt};
Princess Claidie's coming-of-age ceremony is about to begin at the cathedral. I must remain at my post, but why don't you attend?${prompt};
The king has requested your audience. He has selected you from the mountain of adventurers in San d'Oria. You should feel honored!${prompt};
You have matured from a fledgling adventurer into a great asset to our kingdom. Do not let us down.${prompt};
There is no need for modesty at a time like this. The fate of San d'Oria is at stake!${prompt};
The authorities are saying that a dark cloud of despair is looming over the Kingdom. They are asking for the assistance of only the best adventurers.${prompt};
I can think of none more qualified than you. Will you accept this mission?${prompt};
Then proceed to the Audience Chamber in the Chateau d'Oraguille.;
Word has it that His Highness is not feeling that well. He may not be present for your briefing.${prompt};
${choice-player-gender}[Sir/Lady] ${name-player}! The Kingdom is counting on you. Who else, I ask you, is worthy for this task?${prompt};
Ah, a time of great change is upon us. In a matter of days, the Rites of Succession will be held at the cathedral in Northern San d'Oria. It is then that the new heir to the throne will be decided.${prompt};
Due to the unpredictable circumstances that took place at the princess's coming-of-age ceremony, this time, only authorized personnel will be allowed near the proceedings. However, the royal family has requested your services as a guard.${prompt};
Even we Royal Knights have not been granted permission to attend... You must be held in high regard by His Highness. I envy you, ${choice-player-gender}[Sir/Ma'am].${prompt};
When you have finished your preparations, proceed directly to the cathedral to report.${prompt};
Off the record, which of the two princes do you think should be the next heir to the throne?${prompt};
It is a difficult decision, but...;
${selection-lines};
Trion is better suited.;
Pieuje is better suited.${prompt};
Hm...;
Being the oldest, he is the true heir, and many people believe he is the most suited to rule the Kingdom. However, Prince Pieuje's prudent ways may be what this country is lacking.${prompt};
Many think as you do, ${choice-player-gender}[Sir/Lady] ${name-player}. However, what this country may need is someone who will not back down in the face of a threat--someone who will stand up for the pride of the Kingdom.${prompt};
But our opinion is of no matter. Lightbringer will decide who is the most suited to stand over our fine nation. And do not speak a word of today's exchange, for the monarlais will have our heads if he finds out.${prompt};
I realize that you must have many preparations before taking on such an important mission. Take your time and return here when you are ready.${prompt};
"DEBUG: U_MS_START= ""${number: 0}""${prompt}";
DEBUG: Went to Davoi, got the report.${prompt};
Clear Conditions Fulfilled:;
${selection-lines};
1-1　Brought back Orcish Axe.;
1-2　Brought back Bat Fang.;
1-3　Rescued the children.;
2-1　Training complete.;
2-2　Finished Davoi village.;
2-3　Visited other countries.;
3-1　Davoi Killing Grounds.;
3-2.;
3-3.;
4-1.;
4-2.;
4-3.;
5-1.;
5-2.;
5-3.;
6-1.;
6-2.;
7-1.;
7-2.;
8-1.;
8-2.;
9-1.;
9-2.;
10-1.;
10-2.${prompt};
The San d'Oria residential area is ahead. You'll find your Mog House within.${prompt};
I've not told you about Mog Houses yet, have I? Would you care to learn about them now?${prompt};
Care to learn about Mog Houses?;
${selection-lines};
Sure!;
No, thanks.${prompt};
Mog Houses are useful places. You can recover your HP and MP, and store items there.${prompt};
You can also change jobs there.;
All adventurers of San d'Orian citizenship are assigned a Mog House.${prompt};
Make yourself at home!${prompt};
The San d'Oria residential area is ahead. You'll find your Mog House within.${prompt};
Would you like to hear about Mog Houses again?${prompt};
Hmm... So be it.${prompt};
Ahead lies the residential area. You'll find your Mog House within.${prompt};
By the way, my records indicate that you're renting a room in ${choice: 0}[San d'Oria/Bastok/Windurst/Jeuno/Kazham/Rabao/Norg/Al Zahbi].${prompt};
Would you like to check out of the room in ${choice: 0}[San d'Oria/Bastok/Windurst/Jeuno/Kazham/Rabao/Norg/Al Zahbi] and move your things back here?${prompt};
Move back to San d'Oria?;
${selection-lines};
Yes, please.;
No, not yet.${prompt};
It is done. We've checked you out of your Rent-a-Room in ${choice: 0}[San d'Oria/Bastok/Windurst/Jeuno/Kazham/Rabao/Norg/Al Zahbi].${prompt};
All your belongings should be waiting for you inside. Those moogles are amazing creatures, are they not?${prompt};
Ahead lies the residential area. Proceed to your Rent-a-Room, foreigner!${prompt};
If you're already renting here, you may come and go as you please, like the Mog House in your homeland.${prompt};
Ahead lies the residential area.${prompt};
Wait! By law, all foreigners must lease a Rent-a-Room before entering the residential area!${prompt};
Once you've registered with us, you can use it as you would a Mog House back home, wherever that may be.${prompt};
Will you stay in San d'Oria?;
${selection-lines};
Yes.;
No, I'd rather not.${prompt};
All right, then. A San d'Orian Rent-a-Room has been leased to your name. Now move along, foreigner!${prompt};
You can set this as your current home point.;
Once you set a home point, you will return there whenever you are incapacitated.;
Set this as current home point?;
${selection-lines};
Yes.;
No.${prompt};
Home point set!${prompt};
A home point can be set as a spot for you to return to Vana'diel when you have been knocked out. You can also use a home point to teleport to other home points.;
What will you do?;
${selection-lines};
Travel to another home point.;
Set this as your home point.;
Other settings.;
On second thought, never mind.${prompt};
You have registered a new home point!;
You are now able to teleport here from any other home point.${prompt};
You may teleport from here to any other home point you have registered.;
Teleport where?;
${selection-lines};
Never mind.;
${zone: 1[2]}.;
${zone: 2[2]}.;
${zone: 3[2]}.;
${zone: 4[2]}.;
${zone: 5[2]}.;
${zone: 6[2]}.;
${zone: 7[2]}.;
${zone: 8[2]}.;
${zone: 9[2]}.;
${zone: 10[2]}.;
${zone: 11[2]}.;
${zone: 12[2]}.;
${zone: 13[2]}.;
${zone: 14[2]}.;
${zone: 15[2]}.;
${zone: 16[2]}.;
Previous page.;
Next page.${prompt};
Teleport where?（${zone: 33[2]}）;
${selection-lines};
Nowhere.;
Home Point #1${choice: 1}[/ (M)/ (A)/ (E)].;
Home Point #2${choice: 2}[/ (M)/ (A)/ (E)].;
Home Point #3${choice: 3}[/ (M)/ (A)/ (E)].;
Home Point #4${choice: 4}[/ (M)/ (A)/ (E)].;
Home Point #5${choice: 5}[/ (M)/ (A)/ (E)].${prompt};
You have not yet registered any other home points, and thus are unable to teleport.${prompt};
It costs ${number: 3} gil to teleport to Home Point #${number: 2} in ${zone: 1[2]}.;
There is no fee for teleporting to Home Point #${number: 2} in ${zone: 1[2]}.;
${selection-lines};
${choice: 33}[Add to favorites/Remove from favorites].;
Yes, please.;
No, thank you.${prompt};
Teleport to which region?;
${selection-lines};
On second thought, none.;
Select from favorites.;
Current region.;
${choice: 1}[San d'Oria/Movalpolos].;
${choice: 1}[Bastok/Tavnazian Arch].;
${choice: 1}[Windurst/Lumoria].;
${choice: 1}[Jeuno/Mamool Ja Savage].;
${choice: 1}[Tavnazia/Halvung].;
${choice: 1}[West. Aht Urhgan/Arrapago Is].;
${choice: 1}[Adoulin Isles/Ruins of Alzadaal].;
${choice: 1}[Ronfaure/Ronfaure Front].;
${choice: 1}[Zulkheim/Norvallen Front].;
${choice: 1}[Norvallen/Gustaberg Front].;
${choice: 1}[Gustaberg/Derfland Front].;
${choice: 1}[Derfland/Sarutabaruta Front].;
${choice: 1}[Sarutabaruta/Aragoneu Front].;
${choice: 1}[Kolshushu/Fauregandi Front].;
${choice: 1}[Aragoneu/Valdeaunia Front].;
${choice: 1}[Fauregandi/East. Ulbuka].;
${choice: 1}[Valdeaunia/Ra'Kaznar].;
${choice: 1}[Qufim/].;
${choice: 1}[Li'Telor/].;
${choice: 1}[Kuzotz/].;
${choice: 1}[Vollbow/].;
${choice: 1}[Elshimo Low/].;
${choice: 1}[Elshimo Up/].;
${choice: 1}[Tu'Lia/].;
Previous page.;
Next page.${prompt};
Teleport where?;
${selection-lines};
None of these.;
A favorited location.;
An original area.;
A Rise of the Zilart area.;
A Chains of Promathia area.;
A Treasures of Aht Urhgan area.;
A Wings of the Goddess area.;
A Seekers of Adoulin area.${prompt};
You may change the method of selecting the area of your desired home point to teleport to.;
Which setting would you like?;
${selection-lines};
My current setting.;
Select by region.;
Select by expansion.${prompt};
You are now selecting by ${choice: 1}[region/expansion].;
Teleport where?;
${selection-lines};
None of these.;
${zone: 1[2]} #${number: 17}.;
${zone: 2[2]} #${number: 18}.;
${zone: 3[2]} #${number: 19}.;
${zone: 4[2]} #${number: 20}.;
${zone: 5[2]} #${number: 21}.;
${zone: 6[2]} #${number: 22}.;
${zone: 7[2]} #${number: 23}.;
${zone: 8[2]} #${number: 24}.;
${zone: 9[2]} #${number: 25}.;
${choice: 33}[Add to favorites/Remove from favorites].${prompt};
Home Point #${number: 2} in ${zone: 1[2]} has been ${choice: 33}[registered to/removed from] your list of favorite locations.;
Your list of favorite locations is full. You must delete an existing entry in order to register a new one.;
Delete which?;
${selection-lines};
None of these.;
${zone: 1[2]} #${number: 17}.;
${zone: 2[2]} #${number: 18}.;
${zone: 3[2]} #${number: 19}.;
${zone: 4[2]} #${number: 20}.;
${zone: 5[2]} #${number: 21}.;
${zone: 6[2]} #${number: 22}.;
${zone: 7[2]} #${number: 23}.;
${zone: 8[2]} #${number: 24}.;
${zone: 9[2]} #${number: 25}.${prompt};
${color-alt: 161}A mog tablet has been discovered in ${choice: 0}[West Ronfaure/East Ronfaure/the La Theine Plateau/the Valkurm Dunes/Jugner Forest/the Batallia Downs/North Gustaberg/South Gustaberg/the Konschtat Highlands/the Pashhow Marshlands/the Rolanberry Fields/Beaucedine Glacier/Xarcabard/West Sarutabaruta/East Sarutabaruta/the Tahrongi Canyon/the Buburimu Peninsula/the Meriphataud Mountains/the Sauromugue Champaign/Qufim Island/Behemoth's Dominion/Cape Teriggan/the Eastern Altepa Desert/the Sanctuary of Zi'Tah/Ro'Maeve/the Yuhtunga Jungle/the Yhoator Jungle/the Western Altepa Desert/the Valley of Sorrows]!;
${color-alt: 161}The complete set of mog tablets has been restored to Ru'Lude Gardens!;
