Phrase en Anglais;Phrase en Français
The problem is, those Orcs have been showing signs of intelligence lately. They've started using ranged weapons...even machines of war!${prompt};
Our investigations indicate that someone is behind the Orcs, supplying them with weapons.${prompt};
We want you to find a cavern deep in Ghelsba Outpost--a place called Yughott Grotto.${prompt};
We've sent many an adventurer to Yughott Grotto, but few have returned, and we are desperate for knowledge.${prompt};
There may be some...danger involved, but if you provide us with useful information, formal recognition from the Kingdom of San d'Oria will be yours.${prompt};
I'm a little busy here. Report to your country's San d'Orian consulate when you've completed this mission.${prompt};
Well, ${name-player}, it's good to see you again. Let's see the report you've brought back, then!${prompt};
The Shadow Lord...back!? That's impossible! He was slain by our forces in the Great War twenty years ago...${prompt};
What!? The nether beasts have broken out into this land? This is dire news, indeed!${prompt};
If this report is true, we must take action.${prompt};
Hmm...but, to be honest, I find it hard to believe.${prompt};
Very well. I will take this report. You will be issued ${keyitem-article: 1[2]}, as promised.${prompt};
Your latest accomplishment raises your mission rank to 3. Congratulations.${prompt};
You must be weary. Be at ease in this chateau. There is much here to soothe the mind and warm the spirit.${prompt};
I've been waiting for you, ${name-player}. As you've probably already heard from the gatehouse, you are to report to the Embassy of San d'Oria at Jeuno.${prompt};
Our relations with Jeuno are vital to maintaining the balance of power between our Kingdom of San d'Oria, Windurst, and Bastok.${prompt};
You will receive your letter of introduction to Jeuno from His Majesty Royaulais Destin himself. Great honor this is!${prompt};
Proceed through the door to the audience chamber. The king is waiting for you. Remember to mind protocol!${prompt};
You have been granted an audience with the king.${prompt};
You audience with the king is finished.${prompt};
What is the matter? Do not keep the king waiting!${prompt};
Welcome, ${name-player}. I am Destin, King of San d'Oria.${prompt};
Please, be at ease. I've heard of you from Claidie. Much have you done for the Kingdom, it seems!${prompt};
As I'm sure Lord Halver has told you, we decided to appoint you to serve in the Embassy of San d'Oria at Jeuno.${prompt};
Recently we lost one of our staff there. But do not be alarmed, for you shall serve under my direct appointment.${prompt};
Take that letter of introduction with you and depart for Jeuno.${prompt};
The embassy has been informed, and is expecting you. Show the letter to any of the staff there.${prompt};
Depart as soon as you are able.${prompt};
Safe journeys, ${name-player}.${wait-animation: 2}${prompt};
Get to Jeuno, and take that letter of introduction with you. Ambassador Jima is anxious to see you!${prompt};
Hello, ${name-player}. You've rushed back from Jeuno upon hearing the news, right? Well, we've taken care of those bandits already.${prompt};
Well, Halver is exaggerating again, with talk of a botched assassination. What could he mean by the king falling unconscious? Surely he is not calling adventurers to the chateau over such nonsense!${prompt};
Such brigands cannot stand before the might of the Temple Knights! His whisperings dishonor our nation. Do you not agree?${prompt};
Curilla? Are you there?${prompt};
Yes, Your Majesty!${prompt};
Ah, very good. Your leadership was exemplary, as always. Thanks to you, I may focus on my duties.${prompt};
You are too kind, Your Majesty.${prompt};
However, Curilla, there seems to be something you overlooked.${prompt};
Your Majesty?${prompt};
During the uproar, somebody made off with the talisman!${prompt};
The talisman, Your Majesty? Not the one that keeps the Shadow Lord imprisoned!${prompt};
The very one. We were visited by an infiltrator while our eyes were on the brigands.${prompt};
So, the intruders were but a decoy...${prompt};
I suspected them so.${prompt};
And who might know of the talisman's existence, even among San d'Orians? Your Majesty, I fear someone bent on bringing the Shadow Lord back from his exile did this!${prompt};
But before we track down this infiltrator, first must we thwart their sinister plot. Halver, let us decide on a plan of action.${prompt};
"Curilla, be not disheartened; by no means was this your fault. Call off the alert, and return to your regular duties.${prompt}";
Well, ${name-player}, your help is needed yet again. Halver will convey my orders soon enough... Remember, you have our thanks!${prompt};
We shall begin immediate discussion on a policy for action. ${name-player}, you must work on improving your skills and equipment.${prompt};
Speak naught of the attempt on the king's life, nor of this business with the Shadow Lord, lest panic grip the Kingdom!${prompt};
We've come to a decision at last, ${name-player}. We will send an expedition to the accursed Northlands.${prompt};
It will go to the ancient ruins of Fei'Yin, northeast of the Beaucedine Glacier. Of course, you'll be going, too.${prompt};
The ruins are those of a city built by an ancient civilization that we believe was more advanced than our own.${prompt};
The race that lived there called themselves the Zilart. We have found similar ruins on Cape Teriggan to the south.${prompt};
Amazingly they both remain, though they were built long ago. It is as if some unseen force defies time to protect them.${prompt};
Once, thirty years ago, an international expedition was sent to the Northlands. They were to uncover the secret of the Zilart's power.${prompt};
They returned empty-handed. We need you to head to the Beaucedine Glacier and scour the ruins of Fei'Yin yourself.${prompt};
The ruins are overrun with fiends, you know. We captured it from the Shadow Lord twenty years ago at the cost of many lives.${prompt};
We set a seal on the ruined coliseum to strengthen the barrier of the Northlands from the inside.${prompt};
You must find it, and use this new seal to strengthen its magic if necessary.${prompt};
Yes, I'm concerned about the Shadow Lord's return. But if the border falls and the nether beasts pass into our realm, all in this world will fall to ruin.${prompt};
Of course, you'll be going, too.${prompt};
Welcome back, ${name-player}. Time is of the essence, as you know, so I'll dispense with formalities. What did you find in Fei'Yin?${prompt};
So the seal in Fei'Yin was already broken... What will we do, should the nether beasts be brought to battle as they were twenty years ago?${prompt};
The answer is simple, Halver. We must bring the battle to them!${prompt};
But, Your Highness, we lack knowledge of our enemy. Though tempting, an attack would be far too dangerous.${prompt};
An attack would be most effective at this early stage! We need not worry about our forces, either. Plenty of reckless adventurers are willing to fight.${prompt};
Be not so hasty, Prince Trion.${prompt};
Curilla! What a pleasant surprise!${prompt};
Please consider the alliance! We must not move troops beyond our borders without first consulting our allies.${prompt};
The enemy is upon us! We've no time to chat with foreigners. We must act now!${prompt};
Forgive me, but how will we explain this, when it was our responsibility, as watchers of the Northlands, to stop our foes before they struck?${prompt};
It is not our duty to explain to foreigners our kingdom's policies. We should move our forces now, so that no explanation will be needed!${prompt};
Please, I beg you! Ask Jeuno to gather the three great nations, and establish a unified front!${prompt};
Silence, Curilla, silence! Since when have you become the weeping dove?${prompt};
Please, listen to reason, Prince Trion! We have but scarce information on the Shadow Lord's return, and what we do have has been collected by adventurers--it's unreliable at best!${prompt};
But if the Shadow Lord has come again, then we need the help of the other countries even more!${prompt};
I have heard enough of your cooing prattle, Curilla! It is clear I can look to no one but myself for decisive leadership!${prompt};
Where has my dear brother Pieuje has gone off to, and at such a critical time as this?${prompt};
Cooing...prattle?${prompt};
With the reconnaissance of Fei'Yin complete, our kingdom must take action quickly. Unfortunately, with circumstances being what they are, I cannot issue orders for your next mission.${prompt};
I believe it will take some time for us to reach a decision. Your time will come in due course, my friend. Until then, be well.${prompt};
Political maneuvering, you call it? To think our nation could become this cesspool of manipulation and intrigue...${prompt};
We have no time for these antics! If they truly are plotting to raise the Shadow Lord, we have not a moment to lose!${prompt};
Things cannot be allowed to proceed as they are. There must be a way to convince him...${prompt};
I understand his lordship's fervor, but the risk is too great for us. I believe this requires utmost caution.${prompt};
Ah, ${name-player}, is it not? Prince Trion was looking for you.${prompt};
How long do these fools wish to sit here discussing our deaths? We've no time for talk, not anymore.${prompt};
We must move to stop the return of the Shadow Lord, or war will come upon Vana'diel once again.${prompt};
${name-player}, this is an order! Hurry as quickly as you can to Castle Zvahl in the far north, and put an end to this evil scheme of the beastmen!${prompt};
I will accept all responsibility for this mission. Now, go, brave warrior! For the future of Vana'diel!${prompt};
Foolishness! He was destroyed in the Great War, twenty years ago! They must have mistaken another fiend for him--that's what has happened, I'm sure of it!${prompt};
Who is the fool here? If it truly is him, then what? We would be facing far worse than the beastmen rabble then!${prompt};
Think before you speak, brother! If it is him, then why has he not shown himself these last twenty years?${prompt};
I'm saying we cannot afford to take that chance! This is more than an internal affair--we need to send an investigation party, immediately!${prompt};
Welcome, ${name-player}.${prompt};
I am Mistaravant. I have served as head steward of this chateau for many a year.${prompt};
This is the room of King Destin. No place for the likes of you.${prompt};
Do not loiter inside the chateau.${prompt};
What's this? I'll not have miscreants loitering in the chateau or its grounds! Go about your business, or be thrown out, the choice is yours.${prompt};
What's this? What has happened, here?${prompt};
はっ。この者が部屋のドアを開け、;
中へ忍び込もうとしていたので、注意をしていた;
ところであります。${prompt};
ん？　またおまえか。さっきから;
城内をウロチョロするな、と言っておるだろう。;
もう一回やったら、本当につまみ出すからな！${prompt};
おい、何度言ったら判るんだ！？;
あれほど、ウロチョロするな、と言っただろう。${prompt};
おい、この者を城外へつまみ出せ！！${prompt};
Here lies the beloved Queen Leaute.;
May Her Majesty's soul find Paradise.${prompt};
Me name's Chalvatot. I be the gardener here, you see.${prompt};
Don't reckon I've seen you before. A new recruit, are you?${prompt};
Eh? I'm busy, can't you see?${prompt};
What is the matter, Chalvatot?${prompt};
Ah, Your Highness! This stranger just came bargin' in here, so I was about to tell--${prompt};
Wait... I've heard of someone like you.${prompt};
Why, you're a new adventurer, are you not?${prompt};
My name is Claidie I d'Oraguille.${prompt};
Why, ${choice-player-gender}[he/she]'s but a vagrant! There's no need for Your Highness to address ${choice-player-gender}[him/her] so!${prompt};
Now, now, Chalvatot. ${choice-player-gender}[He/She] has come to bolster the strength of our kingdom. Adventurers deserve our gratitude!${prompt};
You are ${name-player}, are you not? Forgive this rude reception.${prompt};
Strive always for the glory of our kingdom! May we meet again, ${name-player}.${prompt};
Hmph. Don't you get uppity, just because the princess saw fit to favor you with a few words. It don't mean a thing!${prompt};
I'm busy. If you don't mind, I'd appreciate a little peace and quiet!${prompt};
This garden be the memorial garden for our late Queen Leaute. She always loved flowers, and so she wanted to be buried here, you see.${prompt};
You be an adventurer from abroad, no? If you've got a mission from the monarlais, you'd best be on it, quick.${prompt};
That monarlais don't like dealing with you foreigners much. Come to think of it, neither do I!${prompt};
I am Rahal S. Lebrart, general of the Royal Knights of San d'Oria.${prompt};
The Royal Knights are the sword of San d'Oria. Swiftly we strike, and wipe nests of fiends off the face of Vana'diel!${prompt};
We are a band of warriors, and some of us have been known to be...overzealous. But there's not a dark heart in the bunch of us. You have my word!${prompt};
I've just returned from Bastok, I have. There be these Quadav living in the mine-holes there!${prompt};
Bastokers delve for stone and let the Quadav be. But I says we should slay every last one of those shell-backed freaks!${prompt};
Royal Knight Aramaviont reporting! I've returned from Windurst. Maybe it's just me, but the wee folk there are hiding something, I know it!${prompt};
Why else would they let Yagudo run wild over the countryside? I'd lock those nasty feathered fowl up in cages if I were them!${prompt};
I am Curilla V Mecru, and these are the Temple Knights' quarters. We are San d'Oria's shield, protecting the walls of the city from fiends.${prompt};
Chateau and city guards also belong to the Temple Knights. Remember, we are here to serve and protect you.${prompt};
Of course, we have little patience with unsavory folk. Take care you're not mistaken for one.${prompt};
Leaving the chateau?${prompt};
Leave the chateau?;
${selection-lines};
Yes.;
No.${prompt};
Then, take care.${prompt};
Then, take your time.${prompt};
The door beyond leads to the Temple Knights' quarters. The dungeons are down the corridor, to the left.${prompt};
The door beyond leads to the Royal Knights' quarters. Down the corridor to the right is the central garden.${prompt};
The audience chamber is beyond. No entry without permission!${prompt};
The audience chamber is beyond. Entrance by appointment only.${prompt};
Please proceed into the audience chamber.${prompt};
The dungeons lie below. If you're here to see a prisoner, make it quick.${prompt};
No entry allowed.${prompt};
Beyond this hallway lies the Queen Leaute Memorial Garden.${prompt};
Princess Claidie's chambers. No entry allowed.${prompt};
This door leads to the throne. If you've an appointment for audience, go around the front.${prompt};
The king's chambers are beyond. If you wish to see the king, schedule an appointment with Monarlais Halver.${prompt};
This is the audience chamber. Enter from the front if you have an appointment.${prompt};
Prince Trion's chambers. No entry.${prompt};
Prince Pieuje's chambers are here. No one allowed without permission.${prompt};
A decorative suit of armor.${prompt};
It's locked.${prompt};
It's locked tight.${prompt};
Obtained key item: ${keyitem-singular: 1[2]}!${prompt};
【デバッグ】条件を変更;
${selection-lines};
サンドリア所属;
バストゥーク所属;
ウィンダス所属;
ランク２初期に戻す;
SCITM_闇の血族報告書;
SCITM_ジュノ大使への紹介状;
SCITM_ジュノへの急使SD;
SCITM_フェインへの新しい護符;
SCITM_フェインの証拠;
setU_MS_START5;
setU_MS_START6;
setU_MS_START7;
setU_MS_START8;
setU_MS_START9;
bitonU_END_SD_MS5;
setU_MS_START12;
setU_MS_START14;
U_d_ghe01A    ゲルスバ２開始;
U_d_ghe01A    ゲルスバ２倒した;
U_d_ghe01A    ゲルスバ２終了;
U_d_ghe01A    ゲルスバ３開始;
U_d_ghe01A    ゲルスバ３終了${prompt};
【デバッグ】変更完了${prompt};
U_MS_STARTは「０」に${prompt};
U_MS_STARTは「５」に${prompt};
U_MS_STARTは「６」に${prompt};
U_MS_STARTは「７」に${prompt};
U_MS_STARTは「８」に${prompt};
U_MS_STARTは「９」に${prompt};
U_MS_STARTは「１０」に${prompt};
U_MS_STARTは「１１」に${prompt};
U_MS_STARTは「１２」に${prompt};
U_MS_STARTは「１３」に${prompt};
U_MS_STARTは「１４」に${prompt};
U_MS_STARTは「１５」に${prompt};
U_MS_STARTは「１６」に${prompt};
闇の血族報告書を入手（デバッグ）${prompt};
Hello there.${prompt};
レストラン『獅子の泉』;
錆びた錨亭;
民宿『不死鳥の止り木』${unknown: 0x7F3307}王室御用達武器庫;
神殿騎士団士官室;
王立騎士団士官室${prompt};
なんだ貴様は？;
ここがどこだか判ってるのか？　さっさと出てゆけ！${prompt};
ぜんぜん異常ありません。${prompt};
濠　閲兵場　槍兵通り　猟犬横丁${prompt};
テストするモーションはどれ？;
${selection-lines};
かしこまる;
遠い目で話す;
考える;
渡す;
話す;
歩く${prompt};
テストするモーションはどれ？;
${selection-lines};
座って話す;
座って考える;
座って振り向く;
歩き;
立って話す${prompt};
よく来たな。待っていたぞ。${prompt};
うーむ……しかし、本当にそのような;
ことが起こりうるものなのか……？${prompt};
おい、ミスタラヴァンはおらぬか？${prompt};
よし、あとは全てわしに任せろ。;
悪いようにはせぬ。安心して待っておれ。${prompt};
かしこまりました。${prompt};
あれは20年前の事でございます。${prompt};
うーむ……困りましたな……。${prompt};
では、これをお持ち下さい。${prompt};
私は執事長のミスタラヴァンだ。;
貴様、見ない顔だな。あまりウロチョロしてると;
つまみ出すからな。${prompt};
Fei'Yin is to the northeast of Beaucedine Glacier. Be wary on the road, there are many beastmen, and worse, about.${prompt};
The prince seems...troubled that a decision has not been made on what action to take. Take care not to further ruffle any royal feathers.${prompt};
Prince Trion went to his chambers a short while ago and has yet to return. You should go speak with him there.${prompt};
I do not know what Prince Trion will say...but I leave your actions to your judgment. You are free to do as you will.${prompt};
How are things in Jeuno? Remember--you're on a direct mission for our king. Do your best.${prompt};
I heard you've received a mission directly from the Archduke of Jeuno himself. Remember, you are a San d'Orian and should always act with pride accordingly.${prompt};
${name-player}! I knew you were the one for the job. But don't rest on your laurels!${prompt};
${name-player}! I knew you were the one for the job. But don't rest on your laurels!${prompt};
With the success of this last mission, I formally bestow upon you: mission rank six.${prompt};
The terror of the Shadow Lord is past. But Vana'diel is never at rest, and our kingdom needs you to watch over it. Vigilance, always!${prompt};
Go, ${name-player}. His Majesty awaits!${prompt};
Trion has spoken to me about you. At long last we meet, ${name-player}. I commend you for putting an end to the Shadow Lord.${prompt};
You have fulfilled my expectations. No, you surpassed them! For that we thank you. May you continue to serve the motherland.${prompt};
Yes... Thanks to you, the Shadow Lord's return was nipped in the bud. We are all in your debt, especially in light of my elder brother's antics.${prompt};
Hmph. Ever the complainer, I see.${prompt};
I showed Halver the ${keyitem-singular: 0[2]} that ${name-player} brought back. He sensed a great negative energy.${prompt};
Hmm...${prompt};
Father, let us not dwell on the petty details! The Shadow Lord is dead, and our greatest threat is no more. We must return our attention to San d'Oria herself.${prompt};
Of course, our nation has fallen ill. Our long struggle with the beastmen has prevented any recovery from the war.${prompt};
Much like the reign of King Ranperre.${prompt};
Ah, the Dragon King, Ranperre?${prompt};
Yes, our great ancestor. But that king pulled our kingdom from the brink, and brought San d'Oria again to greatness.${prompt};
A truly legendary feat.${prompt};
You speak of the Treasure of the Dragon King?${prompt};
Yes. The legends speak of King Ranperre and how he used the Treasure to save his nation.${prompt};
And where may we find...this Treasure?${prompt};
Hmph. If only we knew! This is all but legend, but apparently the king sealed it away somewhere. I cannot fathom why.${prompt};
Many were sent looking for it, but none succeeded. Perhaps now is the time we must find it and break the barrier that protects it.${prompt};
${name-player}, should you uncover any news of Ranperre's Treasure, report to us at once.${prompt};
Father, I urge you to send expeditions to every corner of Vana'diel!${prompt};
Now just a moment, Trion. Why should we wander in darkness when the papsque may still illuminate us?${prompt};
The papsque, Your Majesty?${prompt};
Yes. I have faith that soon he will find some clue for us.${prompt};
My own life is waning. I must solve this mystery while I still breathe!${prompt};
Father...${prompt};
When that time comes, ${name-player}, your assistance will be needed by us all. Do not let us down!${prompt};
${name-player}, I, Claidie, thank you for your acts of courage on behalf of the motherland.${prompt};
When first we met, you were but a fledgling adventurer, and now you are a paragon of virtue.${prompt};
May you continue to strive for the greatness of our nation. Our prayers are with you!${prompt};
That is all for today. Go and rest, for soon enough we may call upon you again.${prompt};
${prompt};
${prompt};
${prompt};
${prompt};
${prompt};
${prompt};
${prompt};
${prompt};
${prompt};
${prompt};
${prompt};
${prompt};
${prompt};
${prompt};
${prompt};
${prompt};
${prompt};
${prompt};
${prompt};
${prompt};
${prompt};
${prompt};
${prompt};
${prompt};
${prompt};
${prompt};
${prompt};
${prompt};
${prompt};
${prompt};
${prompt};
${prompt};
${prompt};
${prompt};
${prompt};
${prompt};
${prompt};
${prompt};
${prompt};
${prompt};
${prompt};
${prompt};
${prompt};
${prompt};
${prompt};
${prompt};
${prompt};
${prompt};
${prompt};
${prompt};
${prompt};
${prompt};
${prompt};
${prompt};
${prompt};
${prompt};
${prompt};
${prompt};
${prompt};
${prompt};
${prompt};
${prompt};
${prompt};
${prompt};
${prompt};
${prompt};
目が痛む。${item-singular: 0[2]}取ってきてくれないか？${prompt};
どうしようか？;
${selection-lines};
やる;
やらない${prompt};
Listen, I want you to bring me water that flows from Horlais Peak. Use this bottle to draw it. I'll be waiting!${prompt};
You have my thanks.${prompt};
Think you could fetch me ${article} ${item-article: 0[2]}?${prompt};
What to do?;
${selection-lines};
Do it.;
Refuse.${prompt};
Ah, almost forgot. You can find ${article} ${item-article: 0[2]} in Derfland. If you are successful, I am sure Queen Leaute would be grateful.${prompt};
Thanks.${prompt};
You are an adventurer in good standing, are you not? I have a request for you, if you've the time.${prompt};
Listen to Curilla's request?;
${selection-lines};
Listen.;
Not now.${prompt};
There is a spring atop Horlais Peak from which the sweetest water flows. I want you to bring me some. I could have one of my knights bring it, but...I would like to keep this an outside job.${prompt};
Why? I have my reasons. Tell me, will you do it?${prompt};
Accept Curilla's request?;
${selection-lines};
Accept.;
Decline.${prompt};
Then, good luck! Use this to draw water from the spring atop Horlais Peak.${prompt};
That is unfortunate. I'll ask somebody else.${prompt};
Ah, it's you again! Have you decided to accept my request?${prompt};
I knew I had judged you well. Thank you for this.${prompt};
What will I use it for? The spring water is good for my eye, you see. I suppose I can tell you...${prompt};
Once, long ago, I faced Prince Trion in the tourneys. But I lost an eye in exchange for the championship.${prompt};
The honor of best sword of San d'Oria was mine...but the eye that I lost still pains me. I consider it punishment for yearning to hear the crowd cheering my name...${prompt};
Please, tell no one. Many knights would seek to take my place if they heard me say such things.${prompt};
I tell you because I judge you an honest ${choice-player-gender}[man/woman]. Please do not tell me I have erred!${prompt};
Thank you, and I will think of you again, next I have need for something.${prompt};
So, you like me garden, eh? Understandably! 'Tis filled with the kindness of Queen Leaute, this place is.${prompt};
Working here, it's like I can feel the warm, merciful smile o' the queen shining down on me.${prompt};
Were Queen Leaute still alive, those two would never be fighting like they do now. Guess it's fate.${prompt};
Hmph. Why am I blabbering about this to the likes of you, eh?${prompt};
Since you seem to have taken a fancy to the garden, here, how's about lending me a hand?${prompt};
I got me a problem, see. No regular compost is good enough to make these flowers bloom the way they do.${prompt};
So I've been using ${item-plural: 0[2]} as a special fertilizer, I have.${prompt};
Only, it be harder than skinning a wild sheep to get those knights off their shiny rumps to help, and now I'm running out.${prompt};
Accept Chalvatot's request?;
${selection-lines};
Accept.;
Decline.${prompt};
Hrm...that's a shame, that is. Guess I'll talk to those knights again.${prompt};
